ID,Role,Message
298.0,Provider,"I can't hear you yet. Tell me your first and last name for the recording. Okay Jason, how is the medicine working for you. Okay, did you have any relapses this week. How many days, how long."
15075.0,Patient,Is the marriage for yesterday.
298.0,Provider,"Okay, and then you wanted to get back on and you got back on this okay."
15075.0,Patient,yeah. Have you been healthy. For the most part yeah okay.
298.0,Provider,that's that's a good thing we do need strength from food. Any negative side effects to the medication does suboxone. Okay. Any problems getting your medicine.
15075.0,Patient,No.
298.0,Provider,"how's your sleep. i'm just working on all the control measures to prescribe this for you. It takes a little bit. anything new in your life going on. Okay, you are good to go, I was able to take care of you saw see you next week okay."
15075.0,Patient,Third Campbell.
298.0,Provider,Okay hi give me just a second here.
